[
  {
    "id": "cm2-2-01",
    "type": "production",
    "module": "entrainement",
    "theme": "calcul-mental",
    "fonctions_ciblees": [
      "automatisation",
      "flexibilite"
    ],
    "palier": 2,
    "prerequis": [
      "cm-palier-1"
    ],
    "cap_complexite": null,
    "contenu": {
      "enonce": "Combien font 5 + 6 ?",
      "aide": "Un presque-double, c'est le double plus un : 7 + 8 = 7 + 7 + 1."
    },
    "reponse": {
      "valeur": 11
    },
    "meta": {
      "auteur": "generation-automatique (tools/generate_items.py)",
      "date_creation": "2026-09-26",
      "relecture_ortho": {
        "statut": "a_revoir"
      }
    }
  },
  {
    "id": "cm2-2-02",
    "type": "production",
    "module": "entrainement",
    "theme": "calcul-mental",
    "fonctions_ciblees": [
      "automatisation",
      "flexibilite"
    ],
    "palier": 2,
    "prerequis": [
      "cm-palier-1"
    ],
    "cap_complexite": null,
    "contenu": {
      "enonce": "Combien font 6 + 7 ?",
      "aide": "Un presque-double, c'est le double plus un : 7 + 8 = 7 + 7 + 1."
    },
    "reponse": {
      "valeur": 13
    },
    "meta": {
      "auteur": "generation-automatique (tools/generate_items.py)",
      "date_creation": "2026-09-26",
      "relecture_ortho": {
        "statut": "a_revoir"
      }
    }
  },
  {
    "id": "cm2-2-03",
    "type": "production",
    "module": "entrainement",
    "theme": "calcul-mental",
    "fonctions_ciblees": [
      "automatisation",
      "flexibilite"
    ],
    "palier": 2,
    "prerequis": [
      "cm-palier-1"
    ],
    "cap_complexite": null,
    "contenu": {
      "enonce": "Combien font 5 + 5 ?",
      "aide": "Un presque-double, c'est le double plus un : 7 + 8 = 7 + 7 + 1."
    },
    "reponse": {
      "valeur": 10
    },
    "meta": {
      "auteur": "generation-automatique (tools/generate_items.py)",
      "date_creation": "2026-09-26",
      "relecture_ortho": {
        "statut": "a_revoir"
      }
    }
  },
  {
    "id": "cm2-2-04",
    "type": "production",
    "module": "entrainement",
    "theme": "calcul-mental",
    "fonctions_ciblees": [
      "automatisation",
      "flexibilite"
    ],
    "palier": 2,
    "prerequis": [
      "cm-palier-1"
    ],
    "cap_complexite": null,
    "contenu": {
      "enonce": "Combien font 8 + 9 ?",
      "aide": "Un presque-double, c'est le double plus un : 7 + 8 = 7 + 7 + 1."
    },
    "reponse": {
      "valeur": 17
    },
    "meta": {
      "auteur": "generation-automatique (tools/generate_items.py)",
      "date_creation": "2026-09-26",
      "relecture_ortho": {
        "statut": "a_revoir"
      }
    }
  },
  {
    "id": "cm2-2-05",
    "type": "production",
    "module": "entrainement",
    "theme": "calcul-mental",
    "fonctions_ciblees": [
      "automatisation",
      "flexibilite"
    ],
    "palier": 2,
    "prerequis": [
      "cm-palier-1"
    ],
    "cap_complexite": null,
    "contenu": {
      "enonce": "Combien font 9 + 9 ?",
      "aide": "Un presque-double, c'est le double plus un : 7 + 8 = 7 + 7 + 1."
    },
    "reponse": {
      "valeur": 18
    },
    "meta": {
      "auteur": "generation-automatique (tools/generate_items.py)",
      "date_creation": "2026-09-26",
      "relecture_ortho": {
        "statut": "a_revoir"
      }
    }
  },
  {
    "id": "cm2-2-06",
    "type": "production",
    "module": "entrainement",
    "theme": "calcul-mental",
    "fonctions_ciblees": [
      "automatisation",
      "flexibilite"
    ],
    "palier": 2,
    "prerequis": [
      "cm-palier-1"
    ],
    "cap_complexite": null,
    "contenu": {
      "enonce": "Combien font 4 + 4 ?",
      "aide": "Un presque-double, c'est le double plus un : 7 + 8 = 7 + 7 + 1."
    },
    "reponse": {
      "valeur": 8
    },
    "meta": {
      "auteur": "generation-automatique (tools/generate_items.py)",
      "date_creation": "2026-09-26",
      "relecture_ortho": {
        "statut": "a_revoir"
      }
    }
  },
  {
    "id": "cm2-2-07",
    "type": "production",
    "module": "entrainement",
    "theme": "calcul-mental",
    "fonctions_ciblees": [
      "automatisation",
      "flexibilite"
    ],
    "palier": 2,
    "prerequis": [
      "cm-palier-1"
    ],
    "cap_complexite": null,
    "contenu": {
      "enonce": "Combien font 8 + 8 ?",
      "aide": "Un presque-double, c'est le double plus un : 7 + 8 = 7 + 7 + 1."
    },
    "reponse": {
      "valeur": 16
    },
    "meta": {
      "auteur": "generation-automatique (tools/generate_items.py)",
      "date_creation": "2026-09-26",
      "relecture_ortho": {
        "statut": "a_revoir"
      }
    }
  },
  {
    "id": "cm2-2-08",
    "type": "production",
    "module": "entrainement",
    "theme": "calcul-mental",
    "fonctions_ciblees": [
      "automatisation",
      "flexibilite"
    ],
    "palier": 2,
    "prerequis": [
      "cm-palier-1"
    ],
    "cap_complexite": null,
    "contenu": {
      "enonce": "Combien font 3 + 4 ?",
      "aide": "Un presque-double, c'est le double plus un : 7 + 8 = 7 + 7 + 1."
    },
    "reponse": {
      "valeur": 7
    },
    "meta": {
      "auteur": "generation-automatique (tools/generate_items.py)",
      "date_creation": "2026-09-26",
      "relecture_ortho": {
        "statut": "a_revoir"
      }
    }
  },
  {
    "id": "cm2-2-09",
    "type": "production",
    "module": "entrainement",
    "theme": "calcul-mental",
    "fonctions_ciblees": [
      "automatisation",
      "flexibilite"
    ],
    "palier": 2,
    "prerequis": [
      "cm-palier-1"
    ],
    "cap_complexite": null,
    "contenu": {
      "enonce": "Combien font 6 + 6 ?",
      "aide": "Un presque-double, c'est le double plus un : 7 + 8 = 7 + 7 + 1."
    },
    "reponse": {
      "valeur": 12
    },
    "meta": {
      "auteur": "generation-automatique (tools/generate_items.py)",
      "date_creation": "2026-09-26",
      "relecture_ortho": {
        "statut": "a_revoir"
      }
    }
  },
  {
    "id": "cm2-2-10",
    "type": "production",
    "module": "entrainement",
    "theme": "calcul-mental",
    "fonctions_ciblees": [
      "automatisation",
      "flexibilite"
    ],
    "palier": 2,
    "prerequis": [
      "cm-palier-1"
    ],
    "cap_complexite": null,
    "contenu": {
      "enonce": "Combien font 4 + 5 ?",
      "aide": "Un presque-double, c'est le double plus un : 7 + 8 = 7 + 7 + 1."
    },
    "reponse": {
      "valeur": 9
    },
    "meta": {
      "auteur": "generation-automatique (tools/generate_items.py)",
      "date_creation": "2026-09-26",
      "relecture_ortho": {
        "statut": "a_revoir"
      }
    }
  },
  {
    "id": "cm2-2-11",
    "type": "production",
    "module": "entrainement",
    "theme": "calcul-mental",
    "fonctions_ciblees": [
      "automatisation",
      "flexibilite"
    ],
    "palier": 2,
    "prerequis": [
      "cm-palier-1"
    ],
    "cap_complexite": null,
    "contenu": {
      "enonce": "Combien font 7 + 7 ?",
      "aide": "Un presque-double, c'est le double plus un : 7 + 8 = 7 + 7 + 1."
    },
    "reponse": {
      "valeur": 14
    },
    "meta": {
      "auteur": "generation-automatique (tools/generate_items.py)",
      "date_creation": "2026-09-26",
      "relecture_ortho": {
        "statut": "a_revoir"
      }
    }
  },
  {
    "id": "cm2-2-12",
    "type": "production",
    "module": "entrainement",
    "theme": "calcul-mental",
    "fonctions_ciblees": [
      "automatisation",
      "flexibilite"
    ],
    "palier": 2,
    "prerequis": [
      "cm-palier-1"
    ],
    "cap_complexite": null,
    "contenu": {
      "enonce": "Combien font 9 + 10 ?",
      "aide": "Un presque-double, c'est le double plus un : 7 + 8 = 7 + 7 + 1."
    },
    "reponse": {
      "valeur": 19
    },
    "meta": {
      "auteur": "generation-automatique (tools/generate_items.py)",
      "date_creation": "2026-09-26",
      "relecture_ortho": {
        "statut": "a_revoir"
      }
    }
  },
  {
    "id": "cm2-2-13",
    "type": "production",
    "module": "entrainement",
    "theme": "calcul-mental",
    "fonctions_ciblees": [
      "automatisation",
      "flexibilite"
    ],
    "palier": 2,
    "prerequis": [
      "cm-palier-1"
    ],
    "cap_complexite": null,
    "contenu": {
      "enonce": "Combien font 3 + 3 ?",
      "aide": "Un presque-double, c'est le double plus un : 7 + 8 = 7 + 7 + 1."
    },
    "reponse": {
      "valeur": 6
    },
    "meta": {
      "auteur": "generation-automatique (tools/generate_items.py)",
      "date_creation": "2026-09-26",
      "relecture_ortho": {
        "statut": "a_revoir"
      }
    }
  },
  {
    "id": "cm2-2-14",
    "type": "production",
    "module": "entrainement",
    "theme": "calcul-mental",
    "fonctions_ciblees": [
      "automatisation",
      "flexibilite"
    ],
    "palier": 2,
    "prerequis": [
      "cm-palier-1"
    ],
    "cap_complexite": null,
    "contenu": {
      "enonce": "Combien font 7 + 8 ?",
      "aide": "Un presque-double, c'est le double plus un : 7 + 8 = 7 + 7 + 1."
    },
    "reponse": {
      "valeur": 15
    },
    "meta": {
      "auteur": "generation-automatique (tools/generate_items.py)",
      "date_creation": "2026-09-26",
      "relecture_ortho": {
        "statut": "a_revoir"
      }
    }
  }
]
